{
  "request_id": "req-20260425-7974",
  "task_id": "auto-push-task",
  "timestamp_utc": "2026-04-25T12:57:38.228Z",
  "source": "github-actions-worker",
  "contract_paths": [
    "prompts/execution-contract-end-state.md",
    "system/no-hitl-execution-header.txt",
    "receipts/schema/runtime-receipt.schema.json"
  ],
  "input_hash": "76ffc93f3226c2348b2ca5cea115d7c83aae966cf7058ba5bab89f85901e3f69",
  "outputs": [
    {
      "type": "file",
      "uri": "outputs/runtime/2026-04-25/auto-push-task.txt",
      "description": "Task output"
    }
  ],
  "logs": [
    {
      "type": "stdout",
      "uri": "outputs/runtime/2026-04-25/auto-push-task.txt",
      "description": "Worker log output"
    }
  ],
  "status": "PASS",
  "reality_classification": "REAL",
  "evidence": [
    "GitHub Actions executed",
    "Output file written",
    "Receipt written"
  ],
  "recovery": {
    "required": false,
    "action": "none"
  }
}