{
  "request_id": "req-2026-04-24-0002",
  "task_id": "pen-first-task-2026-04-24",
  "timestamp_utc": "2026-04-23T23:45:00Z",
  "source": "chatgpt-execution",
  "contract_paths": [
    "prompts/execution-contract-end-state.md",
    "system/no-hitl-execution-header.txt",
    "receipts/schema/runtime-receipt.schema.json"
  ],
  "input_hash": "first-task-input",
  "outputs": [
    {
      "type": "file",
      "uri": "tasks/2026-04-24/first-task.md"
    },
    {
      "type": "file",
      "uri": "outputs/2026-04-24/first-task-output.txt"
    }
  ],
  "logs": [
    {
      "type": "git-commit",
      "uri": "f957f254732a48ff5dfe2094a5dc1b87c661b467"
    },
    {
      "type": "git-commit",
      "uri": "0351fe6e95bbb9831237aee88f2983afd9644e92"
    }
  ],
  "status": "PASS",
  "reality_classification": "REAL",
  "evidence": [
    "Task file created",
    "Output file created",
    "Receipt persisted",
    "Issue updated"
  ],
  "recovery": {
    "required": false,
    "action": "none"
  }
}
